timestamp	experiment	file	sorry_count	axiom_count	error_count	status	description
2026-05-14 09:08:53	exp000	ComplexOAPairBound	0	0	0	keep	rotation cancellation for complex OA
2026-05-14 09:13:46	exp002	ComplexPairBoundProof	1	0	0	keep	complex pair bound formulation (1 sorry)
2026-05-14 09:30:03	exp003	ComplexPairBoundProof	1	0	0	keep	attack turn 1
2026-05-14 09:30:19	exp004	ComplexPairBoundProof	1	0	0	keep	attack turn 2
2026-05-14 09:30:38	exp005	ComplexPairBoundProof	1	0	0	keep	attack turn 3
2026-05-14 09:30:57	exp006	ComplexPairBoundProof	1	0	0	keep	attack turn 4
2026-05-14 09:31:15	exp007	ComplexPairBoundProof	1	0	0	keep	attack turn 5
2026-05-14 09:31:31	exp008	ComplexPairBoundProof	1	0	0	keep	attack turn 6
2026-05-14 09:31:46	exp009	ComplexPairBoundProof	1	0	0	keep	attack turn 7
2026-05-14 09:32:02	exp010	ComplexPairBoundProof	1	0	0	keep	attack turn 8
2026-05-14 09:32:17	exp011	ComplexPairBoundProof	1	0	0	keep	attack turn 9
2026-05-14 09:32:33	exp012	ComplexPairBoundProof	1	0	0	keep	attack turn 10
2026-05-14 09:32:48	exp013	ComplexPairBoundProof	1	0	0	keep	attack turn 11
2026-05-14 09:33:03	exp014	ComplexPairBoundProof	1	0	0	keep	attack turn 12
2026-05-14 09:33:17	exp015	ComplexPairBoundProof	1	0	0	keep	attack turn 13
2026-05-14 09:33:31	exp016	ComplexPairBoundProof	1	0	0	keep	attack turn 14
2026-05-14 09:33:45	exp017	ComplexPairBoundProof	1	0	0	keep	attack turn 15
2026-05-14 09:33:59	exp018	ComplexPairBoundProof	1	0	0	keep	attack turn 16
2026-05-14 09:34:14	exp019	ComplexPairBoundProof	1	0	0	keep	attack turn 17
2026-05-14 09:34:29	exp020	ComplexPairBoundProof	1	0	0	keep	attack turn 18
2026-05-14 09:34:43	exp021	ComplexPairBoundProof	1	0	0	keep	attack turn 19
2026-05-14 09:34:57	exp022	ComplexPairBoundProof	1	0	0	keep	attack turn 20
2026-05-14 09:53:11	exp023	ComplexPairBoundProof	1	0	0	keep	attack turn 1
2026-05-14 09:55:45	exp024	ComplexPairBoundProof	1	0	0	keep	attack turn 2
2026-05-14 09:59:53	exp025	ComplexPairBoundProof	1	0	0	keep	attack turn 3
2026-05-14 10:02:21	exp026	ComplexPairBoundProof	1	0	0	keep	attack turn 4
2026-05-14 10:05:00	exp027	ComplexPairBoundProof	1	0	0	keep	attack turn 5
2026-05-14 22:29:13	exp028	ComplexPairBoundProof	2	0	2	crash	attack turn 1
2026-05-14 22:36:18	exp029	ComplexPairBoundProof	0	0	0	keep	attack turn 2
2026-05-14 22:38:15	exp030	ComplexPairBoundProof	0	0	0	keep	attack turn 3
2026-05-14 22:40:42	exp031	ComplexPairBoundProof	0	0	0	keep	attack turn 4
2026-05-15 03:19:25	exp032	ComplexOAEndToEnd	0	0	0	keep	attack turn 1
2026-05-15 03:21:35	exp033	ComplexOAEndToEnd	0	0	0	keep	attack turn 2
2026-05-15 03:23:31	exp034	ComplexOAEndToEnd	0	0	0	keep	attack turn 3
2026-05-15 03:25:43	exp035	ComplexOAEndToEnd	0	0	0	keep	attack turn 4
2026-05-15 03:27:34	exp036	ComplexOAEndToEnd	0	0	0	keep	attack turn 5
2026-05-15 03:29:14	exp037	ComplexOAVZero	0	0	0	keep	attack turn 1
2026-05-15 03:29:57	exp038	ComplexOAEndToEnd	0	0	0	keep	attack turn 6
2026-05-15 03:31:04	exp039	ComplexOAEndToEnd	0	0	0	keep	attack turn 7
2026-05-15 03:32:35	exp040	ComplexOAVZero	0	0	0	keep	attack turn 2
2026-05-15 03:32:45	exp041	ComplexOAEndToEnd	0	0	0	keep	attack turn 8
2026-05-15 03:33:57	exp042	ComplexOAVZero	0	0	0	keep	attack turn 3
2026-05-15 03:34:20	exp043	ComplexOAEndToEnd	0	0	0	keep	attack turn 9
2026-05-15 03:34:41	exp044	ComplexOAVZero	0	0	0	keep	attack turn 4
2026-05-15 03:35:47	exp045	ComplexOAEndToEnd	0	0	0	keep	attack turn 10
2026-05-15 03:36:37	exp046	ComplexOAVZero	0	0	0	keep	attack turn 5
2026-05-15 03:37:51	exp047	ComplexOAVZero	0	0	0	keep	attack turn 6
2026-05-15 03:39:05	exp048	ComplexOAVZero	0	0	0	keep	attack turn 7
2026-05-15 03:40:44	exp049	ComplexOAVZero	0	0	0	keep	attack turn 8
2026-05-15 03:42:24	exp050	ComplexOAVZero	0	0	0	keep	attack turn 9
2026-05-15 03:44:13	exp051	ComplexOAVZero	0	0	0	keep	attack turn 10
2026-05-15 07:37:43	exp052	ComplexOAVZero	0	0	0	keep	attack turn 1
2026-05-15 07:38:54	exp053	ComplexOAVZero	0	0	0	keep	attack turn 2
2026-05-15 07:40:58	exp054	ComplexOAVZero	0	0	0	keep	attack turn 3
2026-05-15 07:42:01	exp055	ComplexOAVZero	0	0	0	keep	attack turn 4
2026-05-15 07:43:48	exp056	ComplexOAVZero	0	0	0	keep	attack turn 5
2026-05-15 07:45:43	exp057	ComplexOAVZero	0	0	0	keep	attack turn 6
2026-05-15 07:46:38	exp058	ComplexOAFullChain	0	0	4	crash	attack turn 1
2026-05-15 07:46:42	exp059	ComplexOAVZero	0	0	0	keep	attack turn 7
2026-05-15 07:48:23	exp060	ComplexOAVZero	0	0	0	keep	attack turn 8
2026-05-15 07:49:46	exp061	ComplexOAVZero	0	0	0	keep	attack turn 9
2026-05-15 07:50:51	exp062	ComplexOAVZero	0	0	0	keep	attack turn 10
2026-05-15 07:58:02	exp063	ComplexOAFullChain	0	0	0	keep	attack turn 2
2026-05-15 07:58:58	exp064	ComplexOAFullChain	0	0	0	keep	attack turn 3
2026-05-15 08:00:22	exp065	ComplexOAFullChain	0	0	0	keep	final status check
2026-05-15 08:00:31	exp066	ComplexOAFullChain	0	0	0	keep	attack turn 4
2026-05-15 08:01:27	exp067	ComplexOAFullChain	0	0	0	keep	attack turn 5
2026-05-15 08:02:29	exp068	ComplexOAFullChain	0	0	0	keep	attack turn 6
2026-05-15 08:04:09	exp069	ComplexOAFullChain	0	0	0	keep	attack turn 7
2026-05-15 08:05:03	exp070	ComplexOAFullChain	0	0	0	keep	attack turn 8
2026-05-15 08:07:18	exp071	ComplexOAFullChain	1	0	0	keep	attack turn 9
2026-05-15 08:10:27	exp072	ComplexOAFullChain	0	0	0	keep	attack turn 10
2026-05-15 08:10:54	exp073	ComplexOAFullChain	0	0	0	keep	attack turn 1
2026-05-15 08:12:46	exp074	ComplexOAFullChain	0	0	0	keep	attack turn 2
2026-05-15 08:15:57	exp075	ComplexOAFullChain	0	0	0	keep	attack turn 3
2026-05-15 08:17:01	exp076	ComplexOAFullChain	0	0	0	keep	attack turn 4
2026-05-15 08:18:09	exp077	ComplexOAFullChain	0	0	0	keep	attack turn 5
2026-05-15 08:23:04	exp078	ComplexOAFullChain	0	0	0	keep	attack turn 6
2026-05-15 08:24:39	exp079	ComplexOAFullChain	0	0	0	keep	attack turn 7
2026-05-15 08:25:25	exp080	ComplexOAFullChain	0	0	0	keep	attack turn 8
2026-05-15 08:26:53	exp081	ComplexOAFullChain	0	0	0	keep	attack turn 9
2026-05-15 08:28:46	exp082	ComplexOAFullChain	0	0	0	keep	attack turn 10
2026-05-15 10:14:19	exp083	KuramotoEndToEnd	1	0	0	keep	perturbative approach, 1 sorry (Gronwall in basin)
2026-05-16 09:47:38	exp084	KuramotoFresh	0	0	0	keep	attack turn 1
2026-05-16 09:49:12	exp085	KuramotoFresh	0	0	0	keep	attack turn 2
2026-05-16 09:51:05	exp086	KuramotoFresh	0	0	0	keep	attack turn 3
2026-05-16 09:52:20	exp087	KuramotoFresh	0	0	0	keep	attack turn 4
2026-05-16 09:53:28	exp088	KuramotoFresh	0	0	0	keep	attack turn 5
2026-05-16 09:55:00	exp089	KuramotoFresh	0	0	0	keep	attack turn 6
2026-05-16 09:55:52	exp090	KuramotoFresh	0	0	0	keep	attack turn 7
2026-05-16 09:57:46	exp091	KuramotoFresh	0	0	0	keep	attack turn 8
2026-05-16 09:58:58	exp092	KuramotoFresh	0	0	0	keep	attack turn 9
2026-05-16 10:00:42	exp093	KuramotoFresh	0	0	0	keep	attack turn 10
2026-05-17 10:32:31	exp094	GaussianGlobal	4	0	0	keep	attack turn 1
2026-05-17 10:42:49	exp095	GaussianGlobal	0	0	0	keep	attack turn 2
2026-05-17 10:44:29	exp096	GaussianGlobal	0	0	0	keep	attack turn 3
2026-05-17 10:46:08	exp097	GaussianGlobal	0	0	0	keep	attack turn 4
2026-05-17 10:47:58	exp098	GaussianGlobal	0	0	0	keep	attack turn 5
